wtkxjh43hz,蔡兴,布依,女,1965,1,23,河北省衡水市景县北留智镇常庄科南村委会,510227200001122154,葫芦岛市连山区分局,1995.09.24-长期
avib5fmdf4,陈先润,仡佬,女,1953,2,27,江西省萍乡市莲花县神泉乡神泉村委会,330127197702162627,新乡市卫辉市分局,2008.03.14-2018.03.14
qeyw5jy2is,夏治平,毛难,女,1961,6,23,山东省滨州市阳信县水落坡镇西杨村委会,61092219580931771,临夏回族自治州积石山保安族东乡族撒拉族自治县公安局,2006.06.29-2011.06.29
n2uouv391p,仇道滨,蒙古,女,1982,10,23,河南省南阳市唐河县古城乡方庄村委会,14040119691015525,毕节市黔西县分局,1991.04.17-2001.04.17
w7otsw7w5k,陈艳丹,瑶,男,1962,9,5,河南省商丘市睢县长岗镇东村村委会,45130019641009453,黄山市休宁县公安局,1993.01.25-2013.01.25
ddzo3ucggh,张青琳,哈尼,男,1997,6,23,吉林省白山市抚松县泉阳镇泉阳河村委会,222423199005020731,成都市青羊区分局,1993.01.10-2003.01.10
pa64njsx5l,靳晓燕,布朗,男,1971,1,20,四川省达州市渠县涌兴镇兴武村民委员会,411602197904121249,银川市金凤区公安局,2012.04.26-2032.04.26
sh4hc3dukc,梅靖,乌孜别克,女,1977,6,26,山东省泰安市宁阳县鹤山乡王家西皋村委会,110115198307050199,平凉市庄浪县分局,2013.11.29-2033.11.29
v1rd4iwwd6,马岳龙,仫佬,男,1945,2,15,山西省晋中市左权县粟城乡上交漳村委会,530923197104192278,恩施土家族苗族自治州来凤县公安局,2019.12.29-2024.12.29
wfz38racxw,潘光平,仡佬,女,1974,12,4,湖北省鄂州市梁子湖区沼山镇沼山居委会,441425201609186289,周口市太康县公安局,1993.04.03-2003.04.03
w9jmpfxcn0,伯寅,高山,女,1953,11,10,湖南省永州市零陵区水口山镇跃家村委会,63272619500727843,咸阳市武功县公安局,1992.10.28-2012.10.28
uk6bhnmjrr,陈丽帆,畲,女,1991,2,28,山东省德州市陵城区义渡口镇初庄村委会,142322198210091419,荆门市东宝区分局,2003.11.31-2008.11.31
6hppb1bs50,崔志海,彝,女,1958,2,17,湖南省怀化市溆浦县木溪乡田儿冲村村委会,32062219680331265,市辖区南岸区公安局,1996.05.01-2001.05.01
u0hpwwngge,高有华,乌孜别克,女,1957,9,26,贵州省黔东南苗族侗族自治州剑河县柳川镇柳利村委会,22212219460606544,绥化市安达市公安局,2002.06.01-长期
31jgxh8x74,吴长来,布朗,男,1962,5,11,湖北省鄂州市梁子湖区涂家垴镇白云村委会,36262619631118684,秦皇岛市昌黎县分局,2002.07.16-2012.07.16
g0fqjfkhs0,陈天贵,锡伯,男,1992,8,2,辽宁省辽阳市灯塔市五星镇民生一村民委员会,42270119590519549,省直辖县级行政区划天门市公安局,2002.04.21-2012.04.21
33zlllv8pb,刘孟瑶,崩龙,男,1993,1,20,湖南省岳阳市湘阴县文星镇宗棠社区,23122619481021135,长春市南关区分局,2015.08.01-长期
2nvd0codak,曾春苗,佤,女,2011,8,14,河北省张家口市阳原县西城镇大沙沟村委会,152502199502224943,白山市浑江区分局,1990.06.27-长期
zm66sex8gv,金益儿,阿昌,男,1959,2,12,湖南省永州市祁阳县大村甸镇前锋村委会,500224201407102232,昆明市东川区分局,2002.07.23-2012.07.23
0i0u81ynzl,张申祥,普米,女,2010,9,2,江西省赣州市南康区十八塘乡群丰村委会,431081199609014775,绥化市安达市公安局,1996.08.25-2001.08.25
rjtx9glwxk,余德泉,汉,女,1967,2,10,浙江省温州市永嘉县桥头镇林福村委会,41172819490107964,吴忠市红寺堡区公安局,2016.05.17-2021.05.17
o55js3irio,李银月,塔吉克,女,1962,5,11,黑龙江省鹤岗市兴安区峻德路街道办事处峻旺社区,420822201008090791,西宁市湟中县公安局,1995.01.13-2000.01.13
vrksn22y4d,白雪宁,侗,女,2007,3,12,河北省沧州市青县曹寺乡邢家庙村委会,140203197202045864,桂林市灌阳县分局,2005.10.16-2025.10.16
0nbtart0dh,齐素华,哈萨克,女,1951,5,18,山东省临沂市郯城县马头镇科技村村委会,411625198402270171,昭通市彝良县分局,2002.03.15-2022.03.15
8p9ucc40oy,管镇滨,裕固,男,1965,11,10,吉林省白城市通榆县双岗镇太平村委会,150802201306257891,柳州市柳南区公安局,2010.04.25-2030.04.25
3hmxv1xxss,陈彩飞,独龙,男,1974,5,7,陕西省咸阳市永寿县店头镇曹德村委会,652427197110109687,金华市兰溪市公安局,2002.06.25-2007.06.25
68n6u0i9o9,屈明辉,撒拉,男,1989,9,8,陕西省汉中市西乡县峡口镇文溪村委会,372125200411067405,渭南市华县公安局,1997.11.30-2007.11.30
ido36f29vp,查红霞,哈萨克,女,2013,9,26,河南省驻马店市新蔡县河坞乡孙堂村委会,652801201107190286,镇江市丹阳市公安局,2019.03.30-2024.03.30
z90wf7594b,苗言,毛难,女,2004,8,5,四川省资阳市乐至县高寺镇小河村村民委员会,410522197310317494,北海市合浦县分局,2003.09.25-2023.09.25
6k6qv2or80,詹云云,满,女,1947,8,24,甘肃省平凉市崆峒区上杨乡早庄村委会,520281199212105085,九江市湖口县公安局,1996.11.10-长期
cgfs1d4x1p,高顺来,珞巴,男,1992,11,13,山东省聊城市茌平县杨官屯乡窦于村委会,371481198602243749,福州市长乐市分局,2015.01.12-2025.01.12
rbmbp362cx,卢春荣,白,女,1973,1,30,山东省菏泽市东明县长兴集乡任庄村委会,452425200003203562,平凉市灵台县分局,1994.02.22-2004.02.22
71ignr3cnq,尹扬明,哈尼,女,1983,11,15,河南省郑州市中牟县大孟镇洪岗村委会,650102199308108429,三亚市崖州区分局,2004.11.20-2009.11.20
0fco0uhtej,王保才,乌孜别克,女,1955,10,13,内蒙古自治区兴安盟扎赉特旗巴彦高勒镇兴胜村委会,43042319550616947,张家口市桥西区分局,2009.02.01-长期
3yps0dmncy,陈永好,乌孜别克,男,1980,4,27,福建省莆田市仙游县西苑乡前县村委会,51152919480729852,盐城市射阳县公安局,2008.07.24-2028.07.24
7is29ptchp,张明燕,布朗,男,2012,10,25,江西省上饶市鄱阳县饶州街道办事处德化桥社区居民委员会,320506201808015790,西宁市城西区公安局,2004.11.10-2009.11.10
ykxgaz941o,龙柏林,毛难,女,2012,2,4,福建省龙岩市漳平市菁城街道菁东社区居委会,53272319561207925,张家口市阳原县公安局,2019.11.03-2029.11.03
rgylwcwxn8,钟坤荣,维吾尔,女,2010,11,30,安徽省安庆市枞阳县会宫镇安凤村委会,31011419570617006,金华市义乌市公安局,2004.05.30-2024.05.30
brly6tjcyi,范晓毅,毛难,男,2006,12,17,安徽省黄山市休宁县五城镇西田村村委会,37137219550915058,省直辖县级行政区划万宁市公安局,2017.11.16-2037.11.16
4znjdpflmn,骆奇,鄂伦春,男,2010,1,9,福建省泉州市德化县浔中镇世科村委会,654202200802103300,西宁市大通回族土族自治县分局,2013.09.27-2023.09.27
mkpg9do63d,李穗蓉,乌孜别克,男,1956,12,14,河北省邢台市宁晋县唐邱乡孔小营三村委会,21100219551207065,运城市芮城县公安局,1995.03.27-2015.03.27
lkkgjsx9c0,邱广超,珞巴,男,1980,10,30,江西省九江市都昌县汪墩乡林丰村委会,511126200809056364,新乡市封丘县公安局,2008.08.02-2013.08.02
7eh4o4hmd4,梁锡强,纳西,男,1997,1,21,黑龙江省双鸭山市宝清县宝清镇十八里村委会,34188119520611741,邢台市内丘县公安局,2018.11.09-2023.11.09
zhhgvlbn82,王洪起,蒙古,女,1984,4,16,陕西省汉中市汉台区东大街街道办事处新星街居委会,44028219490126566,沈阳市皇姑区公安局,2018.06.12-2028.06.12
5k4akkuk2z,胡大凤,京,男,1999,4,3,四川省甘孜藏族自治州甘孜县扎科乡生达村民委员会,140700198304098596,济南市槐荫区分局,1993.12.28-2013.12.28
lll6jl5l2p,曾唯唯,珞巴,男,1998,4,7,四川省乐山市马边彝族自治县劳动乡柏香村委会,42092319551118010,文山壮族苗族自治州西畴县分局,1995.10.27-2005.10.27
r4myaaac01,王俊巧,哈萨克,女,1959,9,2,湖北省恩施土家族苗族自治州利川市凉雾乡海洋村委会,341722197903096594,岳阳市华容县分局,2011.02.15-长期
m4msvl8ua7,孙建东,基诺,女,2014,5,31,河南省洛阳市洛宁县马店镇关庙村村民委员会,211121198707019161,甘孜藏族自治州巴塘县分局,1998.07.24-2018.07.24
rgh5z2fdt4,杨通明,苗,女,2007,8,30,天津市市辖区东丽区无瑕街道新袁村委会,532523199707107677,阜新市阜新蒙古族自治县分局,2017.05.31-2027.05.31
mu4ic9lmjg,苏丽君,汉,男,1964,6,7,陕西省西安市蓝田县汤峪镇马塬村委会,37283119451001882,邵阳市绥宁县分局,2013.05.21-2033.05.21
zjd33lb74j,阮云燕,珞巴,男,1968,9,4,河南省焦作市孟州市赵和镇大马沟村委会,440500199909036602,玉林市容县分局,1992.04.18-1997.04.18
0or935b56g,金利琴,乌孜别克,男,1964,6,31,广西壮族自治区贵港市平南县武林镇新联村村委会,54252219460207739,滨州市阳信县公安局,1997.02.05-长期
o390wh1hu4,吕凤梅,纳西,男,1949,6,27,江苏省淮安市涟水县唐集镇陆舍村委会,23250220070208463X,通化市东昌区分局,2007.03.08-2017.03.08
udz8biv9vw,邓志维,东乡,女,1969,6,20,山东省临沂市兰陵县金岭镇前张庄村委会,360981197812202292,省直辖县级行政区划昌江黎族自治县分局,2002.05.07-2007.05.07
rniwapyvu8,赵张,回,女,1968,6,27,贵州省黔东南苗族侗族自治州凯里市大风洞乡大坡村委会,21108119630505427,宜昌市夷陵区公安局,2000.11.04-2020.11.04
gwrwegzp01,裘志平,珞巴,女,1981,8,31,辽宁省辽阳市宏伟区工农街道办事处奥林园社区居民委员会,342625200307215072,南充市高坪区公安局,2015.02.11-2020.02.11
f91tmyvj2u,晋斌,鄂温克,男,2004,4,16,福建省莆田市仙游县度尾镇湘溪村委会,131024197712309198,长治市城区分局,2000.11.25-2020.11.25
ptc671500n,徐中梅,畲,女,1980,11,31,黑龙江省哈尔滨市双城区东官镇东利村村委会,430111197404205634,安庆市桐城市公安局,2001.05.30-2021.05.30
jp7nh1kbjj,李培谦,黎,女,1982,8,2,安徽省六安市金寨县燕子河镇金冲村委会,513229200407023937,西双版纳傣族自治州勐海县分局,2003.05.06-长期
7cqmoigun9,谢爱华,哈尼,男,1971,5,6,山西省晋中市昔阳县界都乡联中峪村委会,14232519700722271,曲靖市麒麟区分局,2013.12.27-2018.12.27
snl9sbfsmy,崔红娟,鄂温克,女,1988,5,26,广西壮族自治区南宁市宾阳县大桥镇六龙村委会,33112119580705515,邵阳市新邵县公安局,2013.12.20-2033.12.20
2xd8bi162j,罗赛珍,基诺,男,1953,5,23,山东省济宁市汶上县南站镇黄店南村委会,441601199709118027,安庆市宿松县分局,2000.03.06-2020.03.06
alirw1msbk,王亦欣,布依,男,2011,7,7,四川省绵阳市江油市含增镇谭庄村民委员会,341321197210116918,鄂尔多斯市鄂托克前旗分局,2014.07.02-2034.07.02
a3scs4faby,张起鹏,傣,男,1965,12,5,吉林省吉林市磐石市松山镇新民村委会,542326198308296205,阿勒泰地区哈巴河县公安局,2014.02.15-长期
b5hb2ktyqv,曾玉丹,俄罗斯,男,2012,11,25,河南省商丘市民权县野岗乡双庙村委会,21030419540407853,长沙市天心区公安局,2006.07.20-2026.07.20
v8ndk6ib5u,陈纪瑜,土家,男,1954,12,14,福建省宁德市福鼎市桐城街道天湖社区居委会,441401197509030931,甘南藏族自治州临潭县公安局,2004.10.16-2014.10.16
8yak5wceh7,叶梦华,维吾尔,男,1981,3,3,山东省菏泽市单县黄岗镇前花园村民委员会,13052219470803802,南通市海门市公安局,1997.04.23-2017.04.23
crgmmrda5m,张其康,基诺,女,2002,7,19,山东省潍坊市诸城市百尺河镇大仁和社区村民委员会,450124200507283228,榆林市绥德县分局,2002.09.14-2007.09.14
emfu2lb8in,费旭峰,苗,男,1975,1,9,河南省信阳市固始县陈集镇八店村委会,34020019590710301,陇南市两当县分局,2007.11.29-2012.11.29
sxxxw9an0t,张松龄,塔塔尔,女,1953,11,14,吉林省长春市榆树市闵家镇三合村委会,540302197611112825,武汉市蔡甸区公安局,1996.11.07-2016.11.07
yt51wzsqm3,郑志泉,俄罗斯,男,1999,5,5,浙江省宁波市象山县墙头镇合心村委会,152324199805254908,郑州市新郑市公安局,1993.12.09-1998.12.09
8w7es7y58y,蒋大宗,达斡尔,男,1956,5,18,河北省邢台市巨鹿县堤村乡金玉庄村委会,320830200601081628,通辽市科尔沁左翼后旗公安局,2016.05.29-长期
x7j98qfm36,夏慧琴,汉,女,2011,1,10,广东省河源市紫金县黄塘镇上黄塘村委会,230722201702062673,伊春市汤旺河区分局,2001.04.18-2006.04.18
chsx00m3ro,李跃红,纳西,女,1954,6,8,上海市市辖区宝山区顾村镇星星村村委会,513721197407152139,锦州市凌海市分局,2000.09.20-2010.09.20
ev7188aebh,蔡荣俊,塔塔尔,女,1957,11,25,四川省遂宁市安居区白马镇青峰村村民委员会,53092519721216275X,湘潭市湘乡市分局,2017.04.12-2037.04.12
cec1b9ffte,牛鸣,土,女,1964,10,16,重庆市市辖区綦江区隆盛镇长春村委会,522526201303018640,沈阳市法库县公安局,1999.01.24-2009.01.24
jghmj5v5ri,文桂英,鄂温克,男,1990,6,28,山东省威海市乳山市冯家镇唐家店子村委会,330421198804200115,陇南市成县分局,1996.12.15-长期
vjbk5igox4,刘力志,维吾尔,女,1945,3,1,河南省信阳市商城县长竹园乡汪冲村委会,440784199410196691,省直辖县级行政区划保亭黎族苗族自治县分局,2011.11.25-2031.11.25
igc7xpagk7,高焱明,朝鲜,女,1983,12,11,内蒙古自治区通辽市开鲁县麦新镇林发村委会,520328197705199939,衡阳市祁东县分局,2011.01.23-2021.01.23
p7b6jmknil,吕亚奇,满,女,2002,5,27,河南省信阳市商城县鲇鱼山街道办事处平塘村委会,612330199607291007,湖州市德清县公安局,1999.09.01-长期
d5cus2i86v,王吉星,京,男,1982,2,5,山东省烟台市龙口市徐福街道办事处冯高后村村委会,632123199608230536,﻿市辖区闵行区公安局,1997.02.25-2002.02.25
xlgwtqlxbd,屠红霞,仫佬,女,1986,3,10,江苏省镇江市京口区四牌楼街道江东社区居委会,210602200210289649,文山壮族苗族自治州马关县分局,1994.06.26-2014.06.26
qj7g0s4i7a,钟鸿昌,布依,女,1989,2,14,安徽省六安市舒城县干汊河镇新陶村委会,320571199608105214,秦皇岛市抚宁区公安局,1998.08.04-2008.08.04
lg6nk7pk4b,熊桂芬,基诺,女,1949,5,16,山西省晋中市榆次区修文镇褚村村委会,452628198008187158,抚顺市新宾满族自治县公安局,1991.12.07-长期
tb7e7f2f16,阮晨霖,水,女,2006,12,23,辽宁省营口市老边区边城镇金屯村委会,229004197711218221,德宏傣族景颇族自治州瑞丽市分局,1993.01.12-1998.01.12
2it23zky61,邵淇,塔塔尔,男,1999,6,4,广东省广州市天河区员村街道南富社区居委会,610404201910282438,铜仁市印江土家族苗族自治县分局,2014.09.16-2034.09.16
m4zlfy2q2t,斯培,怒,男,1980,11,8,湖北省黄冈市浠水县团陂镇大塘角村委会,231001201302268231,宜春市樟树市分局,2012.07.08-长期
91bundwpd2,李芝琴,傣,女,2005,12,29,河南省漯河市临颍县三家店镇康庄村委会,53242819560218854,通化市通化县公安局,2005.09.19-长期
1apw679b88,沙长春,佤,女,2010,4,20,河北省邯郸市成安县北乡义乡西乡义村委会,320508199402215877,邵阳市新宁县公安局,2010.08.18-2015.08.18
igybrx58rw,吴继先,怒,女,1964,11,3,吉林省长春市双阳区奢岭街道办事处爱国村委会,642101197208244129,许昌市长葛市分局,2002.03.19-长期
q1wcdvq1q4,夏志新,布朗,男,1955,3,25,湖南省湘潭市韶山市银田镇南村村委会,130607201110080026,甘孜藏族自治州色达县分局,2017.12.25-长期
7lbnlyg249,林正和,达斡尔,男,1989,6,15,云南省曲靖市会泽县金钟街道办事处三家塘村委会,140929198011181681,郑州市中原区分局,2010.11.04-长期
a081669c11,黄文宇,门巴,女,1945,6,10,北京市市辖区通州区潞城镇东杨庄村委会,370404200405301260,廊坊市大厂回族自治县公安局,2002.06.22-2007.06.22
ze1vs4sggl,韩舒燕,毛难,女,1987,6,7,北京市市辖区西城区月坛街道办事处三里河社区第一居委会,442921198307246157,市辖区长宁区分局,1993.10.22-长期
vxr24oheja,蔡世超,京,女,2015,4,30,山东省威海市文登区界石镇南鲁家埠村委会,50010519511009610,池州市石台县分局,2004.01.16-2024.01.16
0rwxfnch1e,张泽军,高山,男,1985,4,21,广东省河源市紫金县龙窝镇琴南村委会,150581201109319068,贵港市港北区分局,1992.12.05-长期
77a5gy8w5e,高德华,佤,女,1972,7,15,江西省吉安市吉水县阜田镇洪洞村委会,500224200601111835,合肥市瑶海区分局,1999.10.25-2019.10.25
j99aca6d7u,刘志洋,门巴,男,1984,7,29,广东省珠海市斗门区井岸镇鸡咀村委会,362321197204197205,酒泉市瓜州县分局,2003.02.09-2023.02.09
avzn8npsw5,王文馨,怒,男,2013,4,17,贵州省遵义市道真仡佬族苗族自治县棕坪乡文联村委会,52032119580626955,荆州市公安县分局,2009.04.02-2019.04.02
zzg4xqaej9,李唯嘉,回,男,1945,2,14,黑龙江省哈尔滨市尚志市长寿乡永安村村委会,370812200402060903,荆门市沙洋县分局,2017.06.12-2037.06.12
5pufsmozs2,黄桂平,京,男,1981,5,6,云南省普洱市孟连傣族拉祜族佤族自治县景信乡勐白村委会,371701200011165921,呼伦贝尔市海拉尔区公安局,2010.02.16-2030.02.16
ubzjtbgoap,林子舒,白,男,1947,9,27,山东省菏泽市巨野县陶庙镇姜谭村民委员会,22088119530717220,西安市蓝田县分局,2016.08.16-2036.08.16
d2mfll6yi4,苏鹏涛,珞巴,女,1965,3,22,湖南省郴州市桂阳县浩塘镇史家桥村村委会,35032219590618272,赣州市会昌县公安局,2007.11.31-长期
6dkdwl3hc7,胡万杰,普米,女,1979,5,28,广西壮族自治区柳州市融水苗族自治县安陲乡吉曼村委会,33060319500802818,鞍山市千山区分局,1993.08.09-长期
vn9l4voq8f,黄细霞,佤,女,1995,4,21,福建省宁德市霞浦县北壁乡池澳村委会,41070219500826781,喀什地区泽普县分局,2019.01.07-2029.01.07
l9evculwhq,张海玲,土,男,2006,4,1,天津市市辖区静海区静海镇泰悦经典社区居委会,339007197605271450,云浮市新兴县公安局,2018.02.09-2028.02.09
g7sb1ez5us,商立,维吾尔,男,1984,5,13,辽宁省锦州市黑山县太和镇尖山子村民委员会,370305197108185496,马鞍山市当涂县分局,2019.05.22-2024.05.22
rvedu0x2kq,赖日全,布朗,男,1952,10,2,四川省绵阳市游仙区石马镇横山村民委员会,513327201612242618,三门峡市湖滨区公安局,2017.03.07-长期
6y2a9o0npa,孙祥瑞,鄂伦春,男,1948,1,21,河北省唐山市滦县九百户镇高家峪村委会,341002199808084090,抚顺市东洲区分局,1993.03.30-长期
7g0np87798,朱长义,仫佬,男,1970,11,22,四川省乐山市沐川县大楠镇金盆村委会,411728201708203146,宁波市海曙区分局,2006.08.30-2026.08.30
zmesjpvd2l,王绍昌,普米,男,1988,5,16,河南省平顶山市汝州市陵头镇寇寨村委会,330483199808200328,三亚市崖州区分局,2005.04.19-2025.04.19
6pzp7v4ynl,于德隆,锡伯,女,1998,4,3,广东省广州市荔湾区西村街道芳村花园社区居委会,210803199103278277,九江市彭泽县公安局,2012.12.10-2032.12.10
2uw1wxcmd6,阮文煊,独龙,女,2009,11,8,陕西省西安市蓝田县小寨镇下湖村委会,52232420050912641X,泰安市新泰市公安局,2002.12.11-2007.12.11
c3v8uimlfg,刘剑斌,瑶,女,1992,7,12,四川省达州市大竹县川主乡宝堂村民委员会,321282201406219695,宜春市樟树市分局,2016.11.28-2026.11.28
8baw3j27dr,张修荣,乌孜别克,女,1973,11,1,陕西省延安市子长县玉家湾镇郝家峁村委会,511501200104310455,广安市武胜县公安局,2009.02.20-2014.02.20
p2xt5mvwca,陈维维,回,男,1947,6,16,江苏省苏州市张家港市金港镇长山村委会,230403200102083321,崇左市龙州县分局,2006.02.25-2016.02.25
ywssah9d89,代文利,东乡,女,1999,1,12,山东省聊城市莘县朝城镇辛庄村委会,430702198406208036,保定市望都县公安局,1993.03.18-长期
luujaqoqjm,王招女,纳西,女,1982,11,7,山东省日照市五莲县街头镇高垛沟村村民委员会,231001199804029406,县垫江县分局,2014.10.16-长期
c2wcr2okr9,郑启福,水,女,2011,1,2,安徽省马鞍山市含山县林头镇鼓山村委会,410727198510041025,攀枝花市仁和区分局,1997.03.28-长期
4hrmcztbj8,周秀莲,锡伯,女,1973,4,25,湖南省永州市双牌县尚仁里乡吉江村委会,21078119581210520,邵阳市洞口县公安局,1997.05.24-长期
ai2zow68h0,董泽民,朝鲜,男,1949,7,26,海南省海口市美兰区演丰镇苏民村委会,230621197304185539,长春市双阳区分局,2013.08.14-2018.08.14
b8gpe5v4w3,任理,俄罗斯,男,2000,11,16,辽宁省铁岭市昌图县大洼镇双山村民委员会,350629199112314879,滁州市天长市分局,2010.07.22-2015.07.22
1sb5gs7rga,田启林,撒拉,女,1953,12,23,湖南省常德市澧县王家厂镇柳津村委会,411303197802141118,柳州市融安县分局,2016.11.17-2026.11.17
6gr4x3c4hq,徐秀梅,瑶,女,1999,1,22,山东省淄博市博山区山头街道办事处樵岭前村委会,330204197906069594,天水市武山县分局,2001.11.01-2011.11.01
q0whdj0koz,曾帆,回,男,1950,11,8,山西省大同市左云县水窑乡大南沟村委会,421004199906015741,邵阳市武冈市分局,2004.01.23-2024.01.23
zb255mr2zt,洪雅,侗,男,1968,5,9,河北省张家口市涿鹿县五堡镇庄科村委会,15062319480122014,桂林市资源县公安局,2000.11.07-长期
g8s3e1dzfq,芦慧,彝,男,1998,3,24,河北省保定市莲池区西关街道办事处郭庄社区居委会,15212519771009729X,巴中市南江县公安局,1995.07.04-2015.07.04
9imwrb8ckg,赵树宝,傣,女,2003,4,30,江西省赣州市信丰县嘉定镇上七里村委会,500227197702063793,市辖区宁河区公安局,2011.01.23-长期
nn2nnnpfds,熊榆,藏,男,2011,12,22,湖南省衡阳市衡阳县库宗桥镇和隆村委会,61262819580408262,邢台市隆尧县分局,2005.07.28-2015.07.28
ibtmpv312n,何冠谊,羌,女,1964,12,2,辽宁省大连市庄河市蓉花山镇双岭村委会,61012519531104110,长治市潞城市分局,2017.10.25-2027.10.25
mvdvpaz6fm,袁习文,鄂温克,女,1962,12,21,贵州省毕节市七星关区八寨镇罗汉山村委会,320117199403149978,包头市青山区分局,2019.03.02-2039.03.02
r18vdhp5yg,郭雪宁,景颇,女,2008,4,18,四川省广元市剑阁县龙源镇七宝村民委员会,513826199209153524,庆阳市宁县分局,2009.02.23-2019.02.23
klp2w7l86o,张玉伟,壮,女,1960,2,20,河南省新乡市卫辉市安都乡君子村村委会,410212199912241426,石家庄市赞皇县公安局,1993.02.19-2013.02.19
oxyfwmqp1r,范明涛,东乡,女,2014,10,10,浙江省湖州市安吉县孝丰镇三眼井社区居委会,45223019560508112,吐鲁番市鄯善县分局,2010.12.29-2020.12.29
d4b9rhnp5x,肖霄,蒙古,男,1989,9,20,山东省滨州市滨城区杨柳雪镇店东李村委会,310120198708075734,湘潭市韶山市分局,2017.07.24-2027.07.24
s8fnkjwpnl,程启荣,仡佬,女,1995,4,7,黑龙江省大庆市杜尔伯特蒙古族自治县一心乡民主村委会,331127201309118651,晋中市和顺县公安局,2002.06.15-2007.06.15
qr5n38wt3e,尹安平,黎,男,1970,10,12,浙江省绍兴市诸暨市陶朱街道红门村委会,41060019471202929,烟台市海阳市分局,1995.08.23-长期
3j6gf7gs1h,甄晓菲,珞巴,女,1988,6,13,山东省青岛市城阳区城阳街道办事处小北曲社区居民委员会,45092119681004079,南京市江宁区分局,1992.07.29-长期
lz7n8ekux2,郑馨怡,拉祜,男,1973,10,25,河南省许昌市鄢陵县张桥镇好汉庄村委会,22222119500706948,红河哈尼族彝族自治州建水县分局,2004.05.02-2014.05.02
ukx9nr1scn,刘赵平,京,女,1979,6,5,四川省南充市蓬安县新园乡麻杨河村村委会,652101201209021466,通辽市霍林郭勒市公安局,2011.08.13-2016.08.13
5w2j5jdf3a,迟芳丽,满,男,1968,5,17,广东省茂名市高州市潘州街道北关居委会,131102199210185931,文山壮族苗族自治州丘北县分局,1996.02.02-长期
5mxjjh4tg1,王曼玉,瑶,男,1995,8,5,四川省阿坝藏族羌族自治州若尔盖县红星镇冻卡村民委员会,360421201912112352,周口市沈丘县公安局,2011.06.30-2021.06.30
2tuuini4ni,丁亚南,仫佬,男,1958,11,2,山东省临沂市兰陵县长城镇徐村村委会,51333119660702172,连云港市海州区分局,1997.05.03-2002.05.03
nk8j40ykt5,戴光明,独龙,女,2012,1,21,安徽省芜湖市无为县严桥镇严桥社区居委会,35020319530917502,保定市定兴县分局,2004.07.13-长期
nifdyi8ns7,蔡正清,京,女,1993,3,1,河南省开封市杞县圉镇镇前刘村村委会,37070119640616840,通辽市科尔沁区公安局,1992.10.20-2002.10.20
ivzefv73i1,张邦栋,瑶,男,1982,12,23,湖南省常德市鼎城区长岭岗乡古堤溶村委会,350625198108265995,九江市瑞昌市分局,2007.05.13-2017.05.13
vz1svcqbly,吴国欢,乌孜别克,男,1951,1,10,广东省深圳市龙岗区布吉街道办事处罗岗社区居委会,230112199506303856,日喀则市康马县公安局,2008.05.26-长期
i5m8x0ynh3,潘晓鸥,佤,女,1993,2,14,河北省邢台市威县枣园乡司庄村委会,33010519640429267,喀什地区莎车县公安局,1994.11.05-2014.11.05
koj3h8xiiq,白永德,仫佬,男,1963,3,4,北京市市辖区顺义区旺泉街道办事处梅沟营村委会,610624198311017467,中卫市海原县公安局,1990.11.25-长期
liujuq3qja,黄风风,藏,女,1997,1,18,内蒙古自治区包头市青山区兴胜镇永和窑子村委会,512330198708140921,泰安市泰山区分局,2014.05.04-2024.05.04
7je9x14pq1,马虎威,朝鲜,男,1995,5,24,浙江省衢州市衢江区大洲镇石屏村村委会,532931199909222304,朝阳市凌源市分局,2004.12.02-2009.12.02
mwsl3cdlsn,俞明霞,傈僳,男,1959,4,23,内蒙古自治区巴彦淖尔市磴口县渡口镇东地村委会,419003200606092966,抚州市金溪县公安局,2000.07.05-2005.07.05
