49dms0u2bo,韩一良,怒,男,1954,6,16,青海省海东市民和回族土族自治县总堡乡三垣村委会,37170319781004016X,汉中市洋县分局,2014.01.08-2019.01.08
6ov0nohnkn,王玮璐,蒙古,男,2006,2,30,北京市县延庆县张山营镇中羊坊村委会,65050219570217330,攀枝花市盐边县公安局,1995.09.29-2015.09.29
fkl5i4gxer,神瑞宝,柯尔克孜,男,2003,12,13,河北省石家庄市新乐市长寿街道办事处新华社区居委会,330201199902039551,吉安市吉水县公安局,2000.07.16-2010.07.16
3citfsymsv,刘燕昌,白,男,2007,11,25,辽宁省大连市庄河市大郑镇宋派村委会,320482198303242670,本溪市平山区公安局,1997.01.31-2007.01.31
9d0b3gi8tp,韩石城,羌,男,1954,1,15,吉林省长春市九台区兴隆街道办事处小荒地村委会,37132319550320835,拉萨市城关区公安局,2015.08.04-长期
21u833on4t,粟文,保安,男,2003,7,14,山西省朔州市平鲁区双碾乡东港村委会,340702197502104251,阿勒泰地区吉木乃县分局,2002.05.02-2012.05.02
qorypfv7tm,陈全秀,布依,女,2005,1,20,山东省济宁市微山县两城镇两城四村村委会,420921201110109156,梧州市蒙山县分局,2018.11.04-2023.11.04
h849c23nvn,吴贵阳,瑶,男,1966,1,26,山东省菏泽市郓城县潘渡镇梁庄村委会,330783201610095679,商洛市山阳县分局,2005.07.31-长期
kw0prvb0s7,陈伊伊,门巴,男,2000,10,19,河南省南阳市内乡县湍东镇茶庵村民委员会,41022519681207435,辽源市东丰县公安局,2007.08.22-2027.08.22
k127fzj3fa,颜铃,景颇,男,1993,10,11,山东省潍坊市安丘市景芝镇后屯村委会,130923198012159521,抚顺市新宾满族自治县公安局,2008.01.03-长期
k3b5rnks0z,胡振昌,维吾尔,女,2010,1,13,湖南省永州市冷水滩区岚角山镇巴洲村委会,63022319461219272,商洛市山阳县分局,2001.09.01-长期
os8nc9lz0b,邱玉慧,珞巴,男,1960,5,14,黑龙江省大庆市萨尔图区东风街道办事处义耕社区居委会,62302519520105066,四平市铁西区公安局,2003.08.04-2023.08.04
r4bxgg2u64,计参,佤,女,1946,1,7,广西壮族自治区玉林市兴业县沙塘镇沙塘社区居委会,610621199602273420,海北藏族自治州门源回族自治县公安局,2012.08.28-2022.08.28
l5l6wdubbv,阿军,藏,男,2004,9,28,黑龙江省牡丹江市宁安市渤海镇土台子村委会,420683197110224705,三门峡市陕县分局,1991.10.12-长期
dvp283thrv,杨光礼,苗,女,1952,6,5,四川省巴中市巴州区梁永镇金浪村民委员会,22028219691014582,淄博市周村区公安局,1991.05.30-2001.05.30
mpskekb0fq,李彩惠,毛难,男,1978,8,6,山东省潍坊市青州市益都街道办事处北河东村委会,420703199903082824,衡水市武邑县分局,2013.08.06-2023.08.06
66cc5ose85,杨仁德,俄罗斯,男,1990,12,24,西藏自治区昌都市察雅县巴日乡温雅村村委会,410481201904179329,市辖区南岸区公安局,2006.02.05-2016.02.05
1am9fnj40t,斯云,侗,女,2015,12,27,山东省临沂市河东区汤头街道办事处黄家屯村委会,43052419650706081,南阳市内乡县分局,1993.08.03-1998.08.03
doc4gdpxb0,封丽丽,裕固,男,1967,9,24,湖南省张家界市永定区永定街道回龙居委会,632300198209283558,普洱市江城哈尼族彝族自治县分局,2002.04.30-2012.04.30
2c00myav8m,吴霭,白,女,1956,2,9,吉林省白城市镇赉县建平乡康平村委会,542136197508300717,杭州市余杭区公安局,1995.05.07-2005.05.07
qlwos65wr5,陈鹏建,汉,男,1970,2,21,内蒙古自治区鄂尔多斯市杭锦旗锡尼镇中图村委会,36072119471211231,南京市玄武区分局,2004.11.16-2024.11.16
zs0e6hfxhl,柴守峰,回,男,1992,2,21,湖南省岳阳市汨罗市汨罗镇燎家山社区,540237201512081161,凉山彝族自治州西昌市分局,2008.09.24-2028.09.24
fssw2gos72,骆雁,怒,男,1954,10,20,四川省泸州市古蔺县黄荆乡黄荆村民委员会,513424198009256066,河池市巴马瑶族自治县公安局,1991.07.20-2001.07.20
2nm59v2p0h,刘亦群,哈萨克,女,1948,1,24,湖南省张家界市慈利县江垭镇清水洞村委会,152102200612067219,洛阳市偃师市分局,2008.06.06-2018.06.06
33ca35k54z,官辉,彝,男,1955,11,14,四川省成都市青白江区祥福镇天星村村民委员会,440111198706283606,烟台市栖霞市分局,2002.03.19-长期
ww0p8oiuo7,马尔克,佤,男,1983,1,2,辽宁省锦州市凌海市新庄子镇向阳村民委员会,62012219510211890,毕节市赫章县分局,2001.05.23-长期
lqy6vuhow5,崔荣汉,藏,女,1995,1,18,山东省青岛市即墨市田横镇马坊村委会,13012619570806753,长治市沁源县公安局,1999.11.10-2009.11.10
94avb8v8pg,杨贵芳,蒙古,女,1978,5,28,西藏自治区山南地区浪卡子县多却乡绒布村委会,110118201207256220,马鞍山市含山县分局,1998.03.09-2018.03.09
dn3ao7t4xl,赵宪,仫佬,男,2003,8,22,江苏省徐州市新沂市时集镇陈刘村委会,450512198808231032,陇南市武都区分局,2009.07.20-2014.07.20
an1pbdtswr,姜立东,拉祜,男,1950,10,19,山东省滨州市博兴县乔庄镇梁楼村委会,36042519630122921,泉州市石狮市公安局,2012.09.29-2017.09.29
iesp0lsiow,毕颖,苗,男,1999,4,12,江西省赣州市赣县田村镇上坪村委会,330305199109218053,焦作市孟州市分局,2017.08.30-长期
